{
  "schema": "intermed-rule-pack-v2",
  "id": "intermed-core",
  "version": "0.2.0",
  "publisher": "intermed",
  "rules": [
    {
      "id": "duplicate-id",
      "kind": "group-distinct",
      "input_kinds": ["mod", "plugin"],
      "group_by": "subject",
      "distinct": "attr:file",
      "min_count": 2,
      "finding": {
        "id": "duplicate-id:{group}",
        "severity": "error",
        "category": "metadata",
        "title": "Duplicate id '{group}' in {count} files",
        "explanation": "The id '{group}' is declared by multiple archives: {values}. Only one can load.",
        "fix": "Remove the duplicate/older jar.",
        "tags": ["metadata", "duplicate"]
      }
    },
    {
      "id": "known-incompatible-mods",
      "kind": "join",
      "left": { "kind": "mod_relationship", "alias": "r", "select": ["subject", "attr:related", "attr:type", "attr:reason", "attr:archive"] },
      "right": { "kind": "mod", "alias": "m2", "select": ["subject", "attr:file"] },
      "on": "r.related = m2.subject",
      "where": "r.type = 'known_incompatible' AND r.subject < r.related AND r.archive != m2.file",
      "finding": {
        "id": "known-incompatible:{r.subject}->{r.related}",
        "rule_id": "known-incompatible",
        "severity": "error",
        "category": "metadata",
        "title": "Known-incompatible mods both installed: {r.subject} + {r.related}",
        "explanation": "`{r.subject}` is known to be incompatible with `{r.related}`, and both are installed. {r.reason}",
        "fix": "Remove one of `{r.subject}` or `{r.related}` — they cannot run together.",
        "affects": ["{r.subject}", "{r.related}"],
        "tags": ["incompatible", "relationship"]
      }
    },
    {
      "id": "loader-mismatch",
      "kind": "join",
      "left": { "kind": "mod", "alias": "m", "select": ["subject", "attr:loader", "attr:identity_certainty"] },
      "right": { "kind": "environment", "alias": "e", "select": ["attr:loader"] },
      "on": "TRUE",
      "where": "m.subject IS NOT NULL AND (m.identity_certainty IS NULL OR m.identity_certainty IN ('confirmed', 'cross-loader-unresolved')) AND e.loader IN ('fabric', 'quilt', 'forge', 'neoforge') AND m.loader IN ('fabric', 'quilt', 'forge', 'neoforge') AND m.loader != e.loader AND NOT (m.loader = 'fabric' AND e.loader = 'quilt')",
      "finding": {
        "id": "loader-mismatch:{m.subject}",
        "severity": "error",
        "category": "loader",
        "title": "'{m.subject}' is a {m.loader} mod on a {e.loader} instance",
        "explanation": "{m.subject} is built for {m.loader}, but this instance runs {e.loader}. Without a compatible runtime bridge, the artifact cannot load.",
        "fix": "If no compatible runtime bridge is present, use the {e.loader} build of this mod or remove it.",
        "tags": ["loader", "mismatch"]
      }
    },
    {
      "id": "side-mismatch-client-on-server",
      "kind": "join",
      "left": { "kind": "mod_side", "alias": "m", "select": ["subject", "attr:side"] },
      "right": { "kind": "environment", "alias": "e", "select": ["attr:side"] },
      "on": "TRUE",
      "where": "m.side IS NOT NULL AND m.side != 'both' AND e.side = 'server' AND m.side = 'client'",
      "finding": {
        "id": "side-mismatch:{m.subject}",
        "severity": "warn",
        "category": "loader",
        "title": "'{m.subject}' is client-only on a server",
        "explanation": "{m.subject} declares environment=client; on a dedicated server it is dead weight or may error.",
        "tags": ["side"]
      }
    },
    {
      "id": "side-mismatch-server-on-client",
      "kind": "join",
      "left": { "kind": "mod_side", "alias": "m", "select": ["subject", "attr:side"] },
      "right": { "kind": "environment", "alias": "e", "select": ["attr:side"] },
      "on": "TRUE",
      "where": "m.side IS NOT NULL AND m.side != 'both' AND e.side = 'client' AND m.side = 'server'",
      "finding": {
        "id": "side-mismatch:{m.subject}",
        "severity": "note",
        "category": "loader",
        "title": "'{m.subject}' is server-only on a client",
        "explanation": "{m.subject} declares environment=server; it will do nothing client-side.",
        "tags": ["side"]
      }
    },
    {
      "id": "resource-conflict-safe-crdt-merge",
      "kind": "fact-finding",
      "input_kinds": ["resource_collision"],
      "where_all": { "attr:class": "safe-crdt-merge" },
      "evidence": {
        "kind": "resource_writer",
        "on": "primary.subject = related.attr:path",
        "relation": "conflicts_with",
        "weight": 0.8
      },
      "finding": {
        "id": "resource-conflict:{attr:class}:{subject}",
        "rule_id": "resource-conflict",
        "severity": "note",
        "category": "resource",
        "title": "Resource can be merged safely: {subject}",
        "explanation": "{writer_count} writer(s) touch this path: {writers_list}. {attr:reason}",
        "fix": "Generate an overlay preview and inspect the merged tag values.",
        "tags": ["resource", "safe-crdt-merge", "safe-merge"]
      }
    },
    {
      "id": "resource-conflict-json-merge",
      "kind": "fact-finding",
      "input_kinds": ["resource_collision"],
      "where_all": { "attr:class": "json-merge-candidate" },
      "evidence": {
        "kind": "resource_writer",
        "on": "primary.subject = related.attr:path",
        "relation": "conflicts_with",
        "weight": 0.8
      },
      "finding": {
        "id": "resource-conflict:{attr:class}:{subject}",
        "rule_id": "resource-conflict",
        "severity": "warn",
        "category": "resource",
        "title": "JSON resource needs merge review: {subject}",
        "explanation": "{writer_count} writer(s) touch this path: {writers_list}. {attr:reason}",
        "fix": "Review the domain semantics and choose an explicit merge or winner; no automatic safe merge is available.",
        "tags": ["resource", "json-merge-candidate"]
      }
    },
    {
      "id": "resource-conflict-unsafe-replace",
      "kind": "fact-finding",
      "input_kinds": ["resource_collision"],
      "where_all": { "attr:class": "unsafe-replace" },
      "evidence": {
        "kind": "resource_writer",
        "on": "primary.subject = related.attr:path",
        "relation": "conflicts_with",
        "weight": 0.8
      },
      "finding": {
        "id": "resource-conflict:{attr:class}:{subject}",
        "rule_id": "resource-conflict",
        "severity": "warn",
        "category": "resource",
        "title": "Resource override is order-dependent: {subject}",
        "explanation": "{writer_count} writer(s) touch this path: {writers_list}. {attr:reason}",
        "fix": "Choose the intended winner or add a compatibility datapack/resourcepack overlay.",
        "tags": ["resource", "unsafe-replace"]
      }
    },
    {
      "id": "resource-conflict-tag-replace",
      "kind": "fact-finding",
      "input_kinds": ["resource_collision"],
      "where_all": { "attr:class": "tag-replace-order-dependent" },
      "evidence": {
        "kind": "resource_writer",
        "on": "primary.subject = related.attr:path",
        "relation": "conflicts_with",
        "weight": 0.8
      },
      "finding": {
        "id": "resource-conflict:{attr:class}:{subject}",
        "rule_id": "resource-conflict",
        "severity": "warn",
        "category": "resource",
        "title": "Tag merge is order-dependent (replace): {subject}",
        "explanation": "{writer_count} writer(s) touch this tag: {writers_list}. {attr:reason}",
        "fix": "A writer uses \"replace\": true. Confirm the intended winner; the set union is not order-independent.",
        "tags": ["resource", "tag-replace-order-dependent"]
      }
    },
    {
      "id": "resource-conflict-tag-mixed-required",
      "kind": "fact-finding",
      "input_kinds": ["resource_collision"],
      "where_all": { "attr:class": "tag-mixed-required" },
      "evidence": {
        "kind": "resource_writer",
        "on": "primary.subject = related.attr:path",
        "relation": "conflicts_with",
        "weight": 0.8
      },
      "finding": {
        "id": "resource-conflict:{attr:class}:{subject}",
        "rule_id": "resource-conflict",
        "severity": "note",
        "category": "resource",
        "title": "Tag entries carry required flags: {subject}",
        "explanation": "{writer_count} writer(s) touch this tag: {writers_list}. {attr:reason}",
        "fix": "Review the optional/required entries; values still union but semantics can differ.",
        "tags": ["resource", "tag-mixed-required"]
      }
    },
    {
      "id": "resource-conflict-tag-remove",
      "kind": "fact-finding",
      "input_kinds": ["resource_collision"],
      "where_all": { "attr:class": "tag-remove-order-dependent" },
      "finding": {
        "id": "resource-conflict:{attr:class}:{subject}",
        "rule_id": "resource-conflict",
        "severity": "warn",
        "category": "resource",
        "title": "Tag patch is order-dependent (remove): {subject}",
        "explanation": "{writer_count} writer(s) touch this tag: {writers_list}. {attr:reason}",
        "fix": "Inspect the NeoForge remove patch in effective resource-pack order; it cannot be represented as a commutative union.",
        "tags": ["resource", "tag-remove-order-dependent"]
      }
    },
    {
      "id": "resource-conflict-tag-invalid",
      "kind": "fact-finding",
      "input_kinds": ["resource_collision"],
      "where_all": { "attr:class": "tag-invalid" },
      "evidence": {
        "kind": "resource_writer",
        "on": "primary.subject = related.attr:path",
        "relation": "conflicts_with",
        "weight": 0.8
      },
      "finding": {
        "id": "resource-conflict:{attr:class}:{subject}",
        "rule_id": "resource-conflict",
        "severity": "warn",
        "category": "resource",
        "title": "Invalid tag document: {subject}",